================================================================================
ASFNet Training Log - LoveDA Dataset
================================================================================

Training Configuration:
--------------------------------------------------------------------------------
  Model: ASFNet (ASFFA + MSFPF + LRDU)
  Dataset: LoveDA
  Batch Size: 4
  Total Epochs: 100
  Learning Rate: 6e-4 (base), 6e-5 (backbone)
  Optimizer: AdamW + Lookahead
  Scheduler: CosineAnnealingWarmRestarts
  Loss Function: Joint Loss (Dice + Cross Entropy)
  Input Size: 1024×1024
--------------------------------------------------------------------------------

Training Progress:
================================================================================

Epoch   0/100
  Train - mIoU: 0.3470, F1: 0.4973, OA: 0.5657
  Val   - mIoU: 0.4012, F1: 0.5581, OA: 0.6064

Epoch   1/100
  Train - mIoU: 0.4901, F1: 0.6505, OA: 0.6657
  Val   - mIoU: 0.4655, F1: 0.6310, OA: 0.6273

Epoch   2/100
  Train - mIoU: 0.5351, F1: 0.6910, OA: 0.6965
  Val   - mIoU: 0.4680, F1: 0.6313, OA: 0.6410

Epoch   3/100
  Train - mIoU: 0.5568, F1: 0.7082, OA: 0.7186
  Val   - mIoU: 0.5145, F1: 0.6685, OA: 0.7202

Epoch   4/100
  Train - mIoU: 0.5823, F1: 0.7305, OA: 0.7338
  Val   - mIoU: 0.5268, F1: 0.6836, OA: 0.7033

Epoch   5/100
  Train - mIoU: 0.5977, F1: 0.7427, OA: 0.7429
  Val   - mIoU: 0.5148, F1: 0.6682, OA: 0.6957

Epoch   6/100
  Train - mIoU: 0.5987, F1: 0.7425, OA: 0.7491
  Val   - mIoU: 0.5255, F1: 0.6729, OA: 0.7296

Epoch   7/100
  Train - mIoU: 0.6089, F1: 0.7511, OA: 0.7546
  Val   - mIoU: 0.5262, F1: 0.6850, OA: 0.6955

Epoch   8/100
  Train - mIoU: 0.6212, F1: 0.7612, OA: 0.7636
  Val   - mIoU: 0.5466, F1: 0.6975, OA: 0.7284

Epoch   9/100
  Train - mIoU: 0.6316, F1: 0.7698, OA: 0.7708
  Val   - mIoU: 0.5451, F1: 0.6964, OA: 0.7236

Epoch  10/100
  Train - mIoU: 0.6355, F1: 0.7726, OA: 0.7729
  Val   - mIoU: 0.5020, F1: 0.6551, OA: 0.6984

Epoch  11/100
  Train - mIoU: 0.6456, F1: 0.7806, OA: 0.7775
  Val   - mIoU: 0.5576, F1: 0.7093, OA: 0.7314

Epoch  12/100
  Train - mIoU: 0.6531, F1: 0.7867, OA: 0.7839
  Val   - mIoU: 0.5515, F1: 0.7050, OA: 0.7292

Epoch  13/100
  Train - mIoU: 0.6550, F1: 0.7884, OA: 0.7847
  Val   - mIoU: 0.5449, F1: 0.6958, OA: 0.7271

Epoch  14/100
  Train - mIoU: 0.6613, F1: 0.7929, OA: 0.7895
  Val   - mIoU: 0.5498, F1: 0.6987, OA: 0.7288

Epoch  15/100
  Train - mIoU: 0.6638, F1: 0.7945, OA: 0.7915
  Val   - mIoU: 0.5459, F1: 0.6981, OA: 0.7284

Epoch  16/100
  Train - mIoU: 0.6697, F1: 0.7990, OA: 0.7952
  Val   - mIoU: 0.5428, F1: 0.6902, OA: 0.7259

Epoch  17/100
  Train - mIoU: 0.6701, F1: 0.7988, OA: 0.7967
  Val   - mIoU: 0.5536, F1: 0.7038, OA: 0.7326

Epoch  18/100
  Train - mIoU: 0.6777, F1: 0.8047, OA: 0.8018
  Val   - mIoU: 0.5595, F1: 0.7065, OA: 0.7381

Epoch  19/100
  Train - mIoU: 0.6790, F1: 0.8060, OA: 0.8030
  Val   - mIoU: 0.5500, F1: 0.6986, OA: 0.7329

Epoch  20/100
  Train - mIoU: 0.6835, F1: 0.8093, OA: 0.8043
  Val   - mIoU: 0.5477, F1: 0.6995, OA: 0.7186

Epoch  21/100
  Train - mIoU: 0.6872, F1: 0.8117, OA: 0.8078
  Val   - mIoU: 0.5461, F1: 0.6938, OA: 0.7334

Epoch  22/100
  Train - mIoU: 0.6927, F1: 0.8160, OA: 0.8120
  Val   - mIoU: 0.5368, F1: 0.6833, OA: 0.7313

Epoch  23/100
  Train - mIoU: 0.6936, F1: 0.8169, OA: 0.8118
  Val   - mIoU: 0.5453, F1: 0.6949, OA: 0.7327

Epoch  24/100
  Train - mIoU: 0.7008, F1: 0.8219, OA: 0.8175
  Val   - mIoU: 0.5324, F1: 0.6824, OA: 0.7165
  >>> Checkpoint saved at epoch 24

Epoch  25/100
  Train - mIoU: 0.6967, F1: 0.8184, OA: 0.8169
  Val   - mIoU: 0.5505, F1: 0.7000, OA: 0.7272

Epoch  26/100
  Train - mIoU: 0.7106, F1: 0.8291, OA: 0.8237
  Val   - mIoU: 0.5456, F1: 0.6940, OA: 0.7274

Epoch  27/100
  Train - mIoU: 0.7097, F1: 0.8276, OA: 0.8254
  Val   - mIoU: 0.5475, F1: 0.6961, OA: 0.7321

Epoch  28/100
  Train - mIoU: 0.7096, F1: 0.8283, OA: 0.8220
  Val   - mIoU: 0.5436, F1: 0.6937, OA: 0.7205

Epoch  29/100
  Train - mIoU: 0.7153, F1: 0.8323, OA: 0.8267
  Val   - mIoU: 0.5503, F1: 0.6998, OA: 0.7315

Epoch  30/100
  Train - mIoU: 0.7155, F1: 0.8321, OA: 0.8288
  Val   - mIoU: 0.5553, F1: 0.7064, OA: 0.7261

Epoch  31/100
  Train - mIoU: 0.7205, F1: 0.8356, OA: 0.8310
  Val   - mIoU: 0.5586, F1: 0.7069, OA: 0.7360

Epoch  32/100
  Train - mIoU: 0.7260, F1: 0.8395, OA: 0.8348
  Val   - mIoU: 0.5565, F1: 0.7040, OA: 0.7320

Epoch  33/100
  Train - mIoU: 0.7255, F1: 0.8391, OA: 0.8360
  Val   - mIoU: 0.5501, F1: 0.6960, OA: 0.7373

Epoch  34/100
  Train - mIoU: 0.7272, F1: 0.8403, OA: 0.8354
  Val   - mIoU: 0.5328, F1: 0.6844, OA: 0.7117

Epoch  35/100
  Train - mIoU: 0.7329, F1: 0.8442, OA: 0.8393
  Val   - mIoU: 0.5515, F1: 0.6988, OA: 0.7354

Epoch  36/100
  Train - mIoU: 0.7348, F1: 0.8456, OA: 0.8408
  Val   - mIoU: 0.5487, F1: 0.6961, OA: 0.7344

Epoch  37/100
  Train - mIoU: 0.7337, F1: 0.8448, OA: 0.8412
  Val   - mIoU: 0.5530, F1: 0.7026, OA: 0.7275

Epoch  38/100
  Train - mIoU: 0.7394, F1: 0.8489, OA: 0.8436
  Val   - mIoU: 0.5458, F1: 0.6944, OA: 0.7239

Epoch  39/100
  Train - mIoU: 0.7352, F1: 0.8458, OA: 0.8416
  Val   - mIoU: 0.5555, F1: 0.7037, OA: 0.7328

Epoch  40/100
  Train - mIoU: 0.7450, F1: 0.8526, OA: 0.8460
  Val   - mIoU: 0.5553, F1: 0.7010, OA: 0.7410

Epoch  41/100
  Train - mIoU: 0.7415, F1: 0.8501, OA: 0.8467
  Val   - mIoU: 0.5482, F1: 0.6950, OA: 0.7366

Epoch  42/100
  Train - mIoU: 0.7432, F1: 0.8514, OA: 0.8452
  Val   - mIoU: 0.5558, F1: 0.7050, OA: 0.7345

Epoch  43/100
  Train - mIoU: 0.7434, F1: 0.8513, OA: 0.8461
  Val   - mIoU: 0.5493, F1: 0.6999, OA: 0.7214

Epoch  44/100
  Train - mIoU: 0.7479, F1: 0.8545, OA: 0.8501
  Val   - mIoU: 0.5561, F1: 0.7058, OA: 0.7262

Epoch  45/100
  Train - mIoU: 0.7529, F1: 0.8578, OA: 0.8518
  Val   - mIoU: 0.5571, F1: 0.7054, OA: 0.7327

Epoch  46/100
  Train - mIoU: 0.7545, F1: 0.8588, OA: 0.8529
  Val   - mIoU: 0.5473, F1: 0.6961, OA: 0.7251

Epoch  47/100
  Train - mIoU: 0.7536, F1: 0.8584, OA: 0.8530
  Val   - mIoU: 0.5488, F1: 0.6959, OA: 0.7289

Epoch  48/100
  Train - mIoU: 0.7579, F1: 0.8612, OA: 0.8546
  Val   - mIoU: 0.5500, F1: 0.6959, OA: 0.7357

Epoch  49/100
  Train - mIoU: 0.7558, F1: 0.8598, OA: 0.8543
  Val   - mIoU: 0.5474, F1: 0.6945, OA: 0.7318
  >>> Checkpoint saved at epoch 49

Epoch  50/100
  Train - mIoU: 0.7595, F1: 0.8622, OA: 0.8558
  Val   - mIoU: 0.5509, F1: 0.6973, OA: 0.7335

Epoch  51/100
  Train - mIoU: 0.7570, F1: 0.8606, OA: 0.8565
  Val   - mIoU: 0.5408, F1: 0.6844, OA: 0.7322

Epoch  52/100
  Train - mIoU: 0.7674, F1: 0.8673, OA: 0.8613
  Val   - mIoU: 0.5523, F1: 0.7005, OA: 0.7296

Epoch  53/100
  Train - mIoU: 0.7689, F1: 0.8684, OA: 0.8628
  Val   - mIoU: 0.5582, F1: 0.7050, OA: 0.7367

Epoch  54/100
  Train - mIoU: 0.7644, F1: 0.8654, OA: 0.8600
  Val   - mIoU: 0.5618, F1: 0.7100, OA: 0.7380

Epoch  55/100
  Train - mIoU: 0.7659, F1: 0.8663, OA: 0.8616
  Val   - mIoU: 0.5543, F1: 0.7013, OA: 0.7343

Epoch  56/100
  Train - mIoU: 0.7692, F1: 0.8685, OA: 0.8635
  Val   - mIoU: 0.5543, F1: 0.7023, OA: 0.7331

Epoch  57/100
  Train - mIoU: 0.7675, F1: 0.8675, OA: 0.8615
  Val   - mIoU: 0.5551, F1: 0.7021, OA: 0.7336

Epoch  58/100
  Train - mIoU: 0.7742, F1: 0.8718, OA: 0.8651
  Val   - mIoU: 0.5612, F1: 0.7089, OA: 0.7374

Epoch  59/100
  Train - mIoU: 0.7758, F1: 0.8727, OA: 0.8665
  Val   - mIoU: 0.5568, F1: 0.7053, OA: 0.7307

Epoch  60/100
  Train - mIoU: 0.7726, F1: 0.8707, OA: 0.8654
  Val   - mIoU: 0.5563, F1: 0.7041, OA: 0.7363

Epoch  61/100
  Train - mIoU: 0.7725, F1: 0.8706, OA: 0.8650
  Val   - mIoU: 0.5399, F1: 0.6850, OA: 0.7287

Epoch  62/100
  Train - mIoU: 0.7752, F1: 0.8724, OA: 0.8661
  Val   - mIoU: 0.5643, F1: 0.7128, OA: 0.7356

Epoch  63/100
  Train - mIoU: 0.7770, F1: 0.8736, OA: 0.8677
  Val   - mIoU: 0.5543, F1: 0.7038, OA: 0.7253

Epoch  64/100
  Train - mIoU: 0.7780, F1: 0.8742, OA: 0.8696
  Val   - mIoU: 0.5538, F1: 0.7015, OA: 0.7312

Epoch  65/100
  Train - mIoU: 0.7765, F1: 0.8732, OA: 0.8688
  Val   - mIoU: 0.5603, F1: 0.7088, OA: 0.7341

Epoch  66/100
  Train - mIoU: 0.7808, F1: 0.8760, OA: 0.8702
  Val   - mIoU: 0.5555, F1: 0.7040, OA: 0.7298

Epoch  67/100
  Train - mIoU: 0.7825, F1: 0.8770, OA: 0.8713
  Val   - mIoU: 0.5559, F1: 0.7034, OA: 0.7322

Epoch  68/100
  Train - mIoU: 0.7809, F1: 0.8759, OA: 0.8715
  Val   - mIoU: 0.5500, F1: 0.6980, OA: 0.7277

Epoch  69/100
  Train - mIoU: 0.7795, F1: 0.8751, OA: 0.8700
  Val   - mIoU: 0.5552, F1: 0.7045, OA: 0.7272

Epoch  70/100
  Train - mIoU: 0.7813, F1: 0.8762, OA: 0.8699
  Val   - mIoU: 0.5553, F1: 0.7023, OA: 0.7333

Epoch  71/100
  Train - mIoU: 0.7845, F1: 0.8783, OA: 0.8731
  Val   - mIoU: 0.5502, F1: 0.6989, OA: 0.7234

Epoch  72/100
  Train - mIoU: 0.7836, F1: 0.8777, OA: 0.8719
  Val   - mIoU: 0.5526, F1: 0.6995, OA: 0.7300

Epoch  73/100
  Train - mIoU: 0.7826, F1: 0.8771, OA: 0.8723
  Val   - mIoU: 0.5561, F1: 0.7033, OA: 0.7337

Epoch  74/100
  Train - mIoU: 0.7819, F1: 0.8767, OA: 0.8717
  Val   - mIoU: 0.5598, F1: 0.7074, OA: 0.7354
  >>> Checkpoint saved at epoch 74

Epoch  75/100
  Train - mIoU: 0.7878, F1: 0.8805, OA: 0.8736
  Val   - mIoU: 0.5549, F1: 0.7020, OA: 0.7346

Epoch  76/100
  Train - mIoU: 0.7917, F1: 0.8829, OA: 0.8765
  Val   - mIoU: 0.5588, F1: 0.7073, OA: 0.7321

Epoch  77/100
  Train - mIoU: 0.7908, F1: 0.8823, OA: 0.8765
  Val   - mIoU: 0.5526, F1: 0.6996, OA: 0.7337

Epoch  78/100
  Train - mIoU: 0.7909, F1: 0.8824, OA: 0.8763
  Val   - mIoU: 0.5519, F1: 0.6988, OA: 0.7314

Epoch  79/100
  Train - mIoU: 0.7911, F1: 0.8824, OA: 0.8762
  Val   - mIoU: 0.5499, F1: 0.6977, OA: 0.7271

Epoch  80/100
  Train - mIoU: 0.7924, F1: 0.8833, OA: 0.8782
  Val   - mIoU: 0.5574, F1: 0.7052, OA: 0.7337

Epoch  81/100
  Train - mIoU: 0.7920, F1: 0.8830, OA: 0.8768
  Val   - mIoU: 0.5542, F1: 0.7012, OA: 0.7350

Epoch  82/100
  Train - mIoU: 0.7922, F1: 0.8831, OA: 0.8781
  Val   - mIoU: 0.5551, F1: 0.7028, OA: 0.7317

Epoch  83/100
  Train - mIoU: 0.7897, F1: 0.8816, OA: 0.8760
  Val   - mIoU: 0.5546, F1: 0.7022, OA: 0.7322

Epoch  84/100
  Train - mIoU: 0.7906, F1: 0.8821, OA: 0.8773
  Val   - mIoU: 0.5558, F1: 0.7040, OA: 0.7322

Epoch  85/100
  Train - mIoU: 0.7937, F1: 0.8841, OA: 0.8790
  Val   - mIoU: 0.5550, F1: 0.7028, OA: 0.7330

Epoch  86/100
  Train - mIoU: 0.7926, F1: 0.8834, OA: 0.8773
  Val   - mIoU: 0.5593, F1: 0.7073, OA: 0.7340

Epoch  87/100
  Train - mIoU: 0.7907, F1: 0.8822, OA: 0.8776
  Val   - mIoU: 0.5556, F1: 0.7034, OA: 0.7329

Epoch  88/100
  Train - mIoU: 0.7891, F1: 0.8811, OA: 0.8763
  Val   - mIoU: 0.5534, F1: 0.7011, OA: 0.7320

Epoch  89/100
  Train - mIoU: 0.7958, F1: 0.8853, OA: 0.8805
  Val   - mIoU: 0.5531, F1: 0.7008, OA: 0.7317

Epoch  90/100
  Train - mIoU: 0.7919, F1: 0.8829, OA: 0.8770
  Val   - mIoU: 0.5532, F1: 0.7013, OA: 0.7312

Epoch  91/100
  Train - mIoU: 0.7902, F1: 0.8819, OA: 0.8769
  Val   - mIoU: 0.5534, F1: 0.7011, OA: 0.7308

Epoch  92/100
  Train - mIoU: 0.7933, F1: 0.8839, OA: 0.8778
  Val   - mIoU: 0.5537, F1: 0.7014, OA: 0.7311

Epoch  93/100
  Train - mIoU: 0.7942, F1: 0.8844, OA: 0.8791
  Val   - mIoU: 0.5559, F1: 0.7037, OA: 0.7333

Epoch  94/100
  Train - mIoU: 0.7933, F1: 0.8839, OA: 0.8784
  Val   - mIoU: 0.5539, F1: 0.7020, OA: 0.7307

Epoch  95/100
  Train - mIoU: 0.7921, F1: 0.8831, OA: 0.8768
  Val   - mIoU: 0.5542, F1: 0.7025, OA: 0.7308

Epoch  96/100
  Train - mIoU: 0.7954, F1: 0.8851, OA: 0.8790
  Val   - mIoU: 0.5561, F1: 0.7036, OA: 0.7330

Epoch  97/100
  Train - mIoU: 0.7957, F1: 0.8853, OA: 0.8804
  Val   - mIoU: 0.5535, F1: 0.7011, OA: 0.7312

Epoch  98/100
  Train - mIoU: 0.7934, F1: 0.8838, OA: 0.8778
  Val   - mIoU: 0.5541, F1: 0.7021, OA: 0.7309

Epoch  99/100
  Train - mIoU: 0.7914, F1: 0.8826, OA: 0.8776
  Val   - mIoU: 0.5535, F1: 0.7013, OA: 0.7310
  >>> Checkpoint saved at epoch 99

================================================================================
Training Summary:
================================================================================

Best Validation mIoU: 0.5643 (Epoch 62)
Best Validation F1:   0.7128 (Epoch 62)
Best Validation OA:   0.7410 (Epoch 40)

Final Epoch (99) Results:
  Validation - mIoU: 0.5535, F1: 0.7013, OA: 0.7310

Convergence Analysis:
  First 20 epochs avg mIoU: 0.5246
  Last 20 epochs avg mIoU:  0.5548
  Improvement: 0.0302 (5.75%)

================================================================================
Training Completed Successfully
================================================================================
